,title,publish_time,journal,url,abstract,doi,cord_uid,words
167324,Pathogenicity and pathogenesis of a United States porcine deltacoronavirus cell culture isolate in 5-day-old neonatal piglets,2015-08-31,Virology,https://doi.org/10.1016/j.virol.2015.03.024; https://www.sciencedirect.com/science/article/pii/S0042682215001609; https://api.elsevier.com/content/article/pii/S0042682215001609; https://www.ncbi.nlm.nih.gov/pubmed/25817405/,"Abstract Porcine deltacoronavirus (PDCoV) was first identified in Hong Kong in 2009–2010 and reported in United States swine for the first time in February 2014. However, diagnostic tools other than polymerase chain reaction for PDCoV detection were lacking and Koch׳s postulates had not been fulfilled to confirm the pathogenic potential of PDCoV. In the present study, PDCoV peptide-specific rabbit antisera were developed and used in immunofluorescence and immunohistochemistry assays to assist PDCoV diagnostics. The pathogenicity and pathogenesis of PDCoV was investigated following orogastric inoculation of 5-day-old piglets with a plaque-purified PDCoV cell culture isolate (3×104 TCID50 per pig). The PDCoV-inoculated piglets developed mild to moderate diarrhea, shed increasing amount of virus in rectal swabs from 2 to 7 days post inoculation, and developed macroscopic and microscopic lesions in small intestines with viral antigen confirmed by immunohistochemistry staining. This study experimentally confirmed PDCoV pathogenicity and characterized PDCoV pathogenesis in neonatal piglets.",10.1016/j.virol.2015.03.024,p5kjnfyf,"['Abstract', 'Porcine', 'deltacoronavirus', 'PDCoV', 'was', 'first', 'identified', 'in', 'Hong', 'Kong', 'in', '2009', '2010', 'and', 'reported', 'in', 'United', 'States', 'swine', 'for', 'the', 'first', 'time', 'in', 'February', '2014', 'However', 'diagnostic', 'tools', 'other', 'than', 'polymerase', 'chain', 'reaction', 'for', 'PDCoV', 'detection', 'were', 'lacking', 'and', 'Koch', 's', 'postulates', 'had', 'not', 'been', 'fulfilled', 'to', 'confirm', 'the', 'pathogenic', 'potential', 'of', 'PDCoV', 'In', 'the', 'present', 'study', 'PDCoV', 'peptide', 'specific', 'rabbit', 'antisera', 'were', 'developed', 'and', 'used', 'in', 'immunofluorescence', 'and', 'immunohistochemistry', 'assays', 'to', 'assist', 'PDCoV', 'diagnostics', 'The', 'pathogenicity', 'and', 'pathogenesis', 'of', 'PDCoV', 'was', 'investigated', 'following', 'orogastric', 'inoculation', 'of', '5', 'day', 'old', 'piglets', 'with', 'a', 'plaque', 'purified', 'PDCoV', 'cell', 'culture', 'isolate', '3', '104', 'TCID50', 'per', 'pig', 'The', 'PDCoV', 'inoculated', 'piglets', 'developed', 'mild', 'to', 'moderate', 'diarrhea', 'shed', 'increasing', 'amount', 'of', 'virus', 'in', 'rectal', 'swabs', 'from', '2', 'to', '7', 'days', 'post', 'inoculation', 'and', 'developed', 'macroscopic', 'and', 'microscopic', 'lesions', 'in', 'small', 'intestines', 'with', 'viral', 'antigen', 'confirmed', 'by', 'immunohistochemistry', 'staining', 'This', 'study', 'experimentally', 'confirmed', 'PDCoV', 'pathogenicity', 'and', 'characterized', 'PDCoV', 'pathogenesis', 'in', 'neonatal', 'piglets', '']"
175297,HRCT imaging features in representative imported cases of 2019 novel coronavirus pneumonia,2020-02-11,Precis Clin Med,https://doi.org/10.1093/pcmedi/pbaa004,"With the spread of novel coronavirus (2019-nCoV) pneumonia, chest high-resolution computed tomography (HRCT) has been one of the key diagnostic tools. To achieve early and accurate diagnostics, determining the radiological characteristics of the disease is of great importance. In this small scale research we retrospectively reviewed and selected six cases confirmed with 2019-nCoV infection in West China Hospital and investigated their initial and follow-up HRCT features, along with the clinical characteristics. The 2019-nCoV pneumonia basically showed a multifocal or unifocal involvement of ground-glass opacity (GGO), sometimes with consolidation and fibrosis. No pleural effusion or lymphadenopathy was identified in our presented cases. The follow-up CT generally demonstrated mild to moderate progression of the lesion, with only one case showing remission by the reducing extent and density of the airspace opacification.",10.1093/pcmedi/pbaa004,95t3zka6,"['With', 'the', 'spread', 'of', 'novel', 'coronavirus', '2019', 'nCoV', 'pneumonia', 'chest', 'high', 'resolution', 'computed', 'tomography', 'HRCT', 'has', 'been', 'one', 'of', 'the', 'key', 'diagnostic', 'tools', 'To', 'achieve', 'early', 'and', 'accurate', 'diagnostics', 'determining', 'the', 'radiological', 'characteristics', 'of', 'the', 'disease', 'is', 'of', 'great', 'importance', 'In', 'this', 'small', 'scale', 'research', 'we', 'retrospectively', 'reviewed', 'and', 'selected', 'six', 'cases', 'confirmed', 'with', '2019', 'nCoV', 'infection', 'in', 'West', 'China', 'Hospital', 'and', 'investigated', 'their', 'initial', 'and', 'follow', 'up', 'HRCT', 'features', 'along', 'with', 'the', 'clinical', 'characteristics', 'The', '2019', 'nCoV', 'pneumonia', 'basically', 'showed', 'a', 'multifocal', 'or', 'unifocal', 'involvement', 'of', 'ground', 'glass', 'opacity', 'GGO', 'sometimes', 'with', 'consolidation', 'and', 'fibrosis', 'No', 'pleural', 'effusion', 'or', 'lymphadenopathy', 'was', 'identified', 'in', 'our', 'presented', 'cases', 'The', 'follow', 'up', 'CT', 'generally', 'demonstrated', 'mild', 'to', 'moderate', 'progression', 'of', 'the', 'lesion', 'with', 'only', 'one', 'case', 'showing', 'remission', 'by', 'the', 'reducing', 'extent', 'and', 'density', 'of', 'the', 'airspace', 'opacification', '']"
177282,Multifunctional nano-magnetic particles assisted viral RNA-extraction protocol for potential detection of COVID-19,2020-05-18,Mater. Res. Innov.,https://doi.org/10.1080/14328917.2020.1769350,"The enduring outbreak of the corona virus disease (COVID-19) originated from China illustrates global concerns owing to their infective nature and time-consuming incubation. Even though diagnostic tools based on RT-PCR are being extensively employed at present, well-timed and precise diagnostics are still restricted because of the long-period and exhaustive man-power requirement. To tackle this problem, we herewith report the fabrication of the surface functionalised magnetic nanoparticles (MNP’s) and viral RNA-extraction protocol for potential detection of COVID-19. The zinc ferrite nanoparticles were prepared by combustion synthesis and its surface was functionalised by silica and carboxyl-modified polyvinyl alcohol. The MNP’s were characterized to confirm the nano-scale appearance and functionalization. The proposed model may provide the ability to extract the viral RNA from several specimens through automation process. In light of ease and proficiency, this protocol may significantly lessen the operation period and necessities for the present molecular-level diagnostic of COVID-19.",10.1080/14328917.2020.1769350,2v1pqnjt,"['The', 'enduring', 'outbreak', 'of', 'the', 'corona', 'virus', 'disease', 'COVID', '19', 'originated', 'from', 'China', 'illustrates', 'global', 'concerns', 'owing', 'to', 'their', 'infective', 'nature', 'and', 'time', 'consuming', 'incubation', 'Even', 'though', 'diagnostic', 'tools', 'based', 'on', 'RT', 'PCR', 'are', 'being', 'extensively', 'employed', 'at', 'present', 'well', 'timed', 'and', 'precise', 'diagnostics', 'are', 'still', 'restricted', 'because', 'of', 'the', 'long', 'period', 'and', 'exhaustive', 'man', 'power', 'requirement', 'To', 'tackle', 'this', 'problem', 'we', 'herewith', 'report', 'the', 'fabrication', 'of', 'the', 'surface', 'functionalised', 'magnetic', 'nanoparticles', 'MNP', 's', 'and', 'viral', 'RNA', 'extraction', 'protocol', 'for', 'potential', 'detection', 'of', 'COVID', '19', 'The', 'zinc', 'ferrite', 'nanoparticles', 'were', 'prepared', 'by', 'combustion', 'synthesis', 'and', 'its', 'surface', 'was', 'functionalised', 'by', 'silica', 'and', 'carboxyl', 'modified', 'polyvinyl', 'alcohol', 'The', 'MNP', 's', 'were', 'characterized', 'to', 'confirm', 'the', 'nano', 'scale', 'appearance', 'and', 'functionalization', 'The', 'proposed', 'model', 'may', 'provide', 'the', 'ability', 'to', 'extract', 'the', 'viral', 'RNA', 'from', 'several', 'specimens', 'through', 'automation', 'process', 'In', 'light', 'of', 'ease', 'and', 'proficiency', 'this', 'protocol', 'may', 'significantly', 'lessen', 'the', 'operation', 'period', 'and', 'necessities', 'for', 'the', 'present', 'molecular', 'level', 'diagnostic', 'of', 'COVID', '19', '']"
199372,Aspects of nano-enabling biosensing systems for intelligent healthcare; towards COVID-19 management,2020-06-05,Mater Today Chem,https://api.elsevier.com/content/article/pii/S2468519420300665; https://doi.org/10.1016/j.mtchem.2020.100306; https://www.sciencedirect.com/science/article/pii/S2468519420300665?v=s5,"Biosensors are emerging as efficient (sensitive and selective) and affordable analytical diagnostic tools for early-stage disease detection, as required for personalized health wellness management. Low-level detection of a targeted disease biomarker (pM level) has emerged extremely useful to evaluate the progression of disease under therapy. Such collected bioinformatics and its multi-aspects-oriented analytics is in demand to explore the effectiveness of prescribed treatment, optimize therapy, and correlate biomarker level with disease pathogenesis. Owing to nanotechnology-enabled advancements in sensing unit fabrication, device integration, interfacing, packaging, and sensing performance at point-of-care (POC) made diagnostics according to the requirements of disease management and patient disease profile i.e., in a personalized manner. Efforts are continuously being made to promote state of art biosensing technology as a next-generation non-invasive disease diagnostics methodology. Keeping this in view, this progressive opinion article describes personalized health care management related analytical tools which provide access to better health for everyone, overall to manage healthy tomorrow timely. Considering accomplishments and predictions, such affordable intelligent diagnostics tools are urgently required to manage COVID-19 pandemic, a life-threatening respiratory infectious disease, where a rapid, selective and sensitive detection of human beta severe acute respiratory system coronavirus (SARS-COoV-2) protein is the key factor.",10.1016/j.mtchem.2020.100306,4vjf6sgs,"['Biosensors', 'are', 'emerging', 'as', 'efficient', 'sensitive', 'and', 'selective', 'and', 'affordable', 'analytical', 'diagnostic', 'tools', 'for', 'early', 'stage', 'disease', 'detection', 'as', 'required', 'for', 'personalized', 'health', 'wellness', 'management', 'Low', 'level', 'detection', 'of', 'a', 'targeted', 'disease', 'biomarker', 'pM', 'level', 'has', 'emerged', 'extremely', 'useful', 'to', 'evaluate', 'the', 'progression', 'of', 'disease', 'under', 'therapy', 'Such', 'collected', 'bioinformatics', 'and', 'its', 'multi', 'aspects', 'oriented', 'analytics', 'is', 'in', 'demand', 'to', 'explore', 'the', 'effectiveness', 'of', 'prescribed', 'treatment', 'optimize', 'therapy', 'and', 'correlate', 'biomarker', 'level', 'with', 'disease', 'pathogenesis', 'Owing', 'to', 'nanotechnology', 'enabled', 'advancements', 'in', 'sensing', 'unit', 'fabrication', 'device', 'integration', 'interfacing', 'packaging', 'and', 'sensing', 'performance', 'at', 'point', 'of', 'care', 'POC', 'made', 'diagnostics', 'according', 'to', 'the', 'requirements', 'of', 'disease', 'management', 'and', 'patient', 'disease', 'profile', 'i', 'e', 'in', 'a', 'personalized', 'manner', 'Efforts', 'are', 'continuously', 'being', 'made', 'to', 'promote', 'state', 'of', 'art', 'biosensing', 'technology', 'as', 'a', 'next', 'generation', 'non', 'invasive', 'disease', 'diagnostics', 'methodology', 'Keeping', 'this', 'in', 'view', 'this', 'progressive', 'opinion', 'article', 'describes', 'personalized', 'health', 'care', 'management', 'related', 'analytical', 'tools', 'which', 'provide', 'access', 'to', 'better', 'health', 'for', 'everyone', 'overall', 'to', 'manage', 'healthy', 'tomorrow', 'timely', 'Considering', 'accomplishments', 'and', 'predictions', 'such', 'affordable', 'intelligent', 'diagnostics', 'tools', 'are', 'urgently', 'required', 'to', 'manage', 'COVID', '19', 'pandemic', 'a', 'life', 'threatening', 'respiratory', 'infectious', 'disease', 'where', 'a', 'rapid', 'selective', 'and', 'sensitive', 'detection', 'of', 'human', 'beta', 'severe', 'acute', 'respiratory', 'system', 'coronavirus', 'SARS', 'COoV', '2', 'protein', 'is', 'the', 'key', 'factor', '']"
199740,A Review of Salivary Diagnostics and Its Potential Implication in Detection of Covid-19,2020-04-17,Cureus,https://doi.org/10.7759/cureus.7708; https://www.ncbi.nlm.nih.gov/pubmed/32313785/,"Saliva is an exocrine secretion produced from the salivary glands and has numerous functions, such as cleansing and protection of the oral cavity, antimicrobial effects and aids in digestion. Due to the speedy development in the field of salivaomics, saliva is now well accepted as a pool of biological markers that vary from changes in biochemicals, nucleic acids and proteins to the microflora. Saliva has an immense potential as a diagnostic fluid and offers an edge over other biological fluids as its collection method does not require invasive procedure, economical and is useful for monitoring systemic health. Development of sensitive and precise salivary diagnostic tools and the formulation of defined guidelines following meticulous testing will allow salivary diagnostics to be utilised as chair side tests for various oral and systemic diseases in the near future. The coronavirus disease (Covid-19) pandemic is the biggest challenge and global health crisis for the world since World War Two. Rapid and accurate diagnosis of Covid-19 is crucial in controlling the outbreak in the community and in hospitals. Nasopharyngeal and oropharyngeal swabs are the recommended specimen types for Covid-19 diagnostic testing. The collection of these specimen types requires close contact between healthcare workers and patients and poses a risk of transmission of the virus, causes discomfort and may cause bleeding, especially in patients with condition such as thrombocytopenia. Hence, nasopharyngeal or oropharyngeal swabs are not desirable for sequential monitoring of viral load. Saliva specimens can be obtained easily as the patient is asked to spit into a sterile bottle. The collection of saliva is non-invasive and greatly minimizes the exposure of healthcare workers to Covid-19. Saliva has a high consistency rate of greater than 90% with nasopharyngeal specimens in the detection of respiratory viruses, including coronaviruses. Saliva has also been used in screening respiratory viruses among hospitalized patients without pyrexia or respiratory symptoms. SARS-CoV can be detected in saliva at high titers. Salivary diagnostics is a dynamic field that is being incorporated as part of disease diagnosis, clinical monitoring of systemic health and to make significant clinical decisions for patient care. More research is required to analyze the potential diagnostic of Covid-19 in saliva to develop rapid chair side tests for the detection of Covid-19 and it is also pivotal to improve and develop successful strategies for prevention, especially for dentists and healthcare professionals who are involved in performing aerosol-generating procedures.",10.7759/cureus.7708,awy3aans,"['Saliva', 'is', 'an', 'exocrine', 'secretion', 'produced', 'from', 'the', 'salivary', 'glands', 'and', 'has', 'numerous', 'functions', 'such', 'as', 'cleansing', 'and', 'protection', 'of', 'the', 'oral', 'cavity', 'antimicrobial', 'effects', 'and', 'aids', 'in', 'digestion', 'Due', 'to', 'the', 'speedy', 'development', 'in', 'the', 'field', 'of', 'salivaomics', 'saliva', 'is', 'now', 'well', 'accepted', 'as', 'a', 'pool', 'of', 'biological', 'markers', 'that', 'vary', 'from', 'changes', 'in', 'biochemicals', 'nucleic', 'acids', 'and', 'proteins', 'to', 'the', 'microflora', 'Saliva', 'has', 'an', 'immense', 'potential', 'as', 'a', 'diagnostic', 'fluid', 'and', 'offers', 'an', 'edge', 'over', 'other', 'biological', 'fluids', 'as', 'its', 'collection', 'method', 'does', 'not', 'require', 'invasive', 'procedure', 'economical', 'and', 'is', 'useful', 'for', 'monitoring', 'systemic', 'health', 'Development', 'of', 'sensitive', 'and', 'precise', 'salivary', 'diagnostic', 'tools', 'and', 'the', 'formulation', 'of', 'defined', 'guidelines', 'following', 'meticulous', 'testing', 'will', 'allow', 'salivary', 'diagnostics', 'to', 'be', 'utilised', 'as', 'chair', 'side', 'tests', 'for', 'various', 'oral', 'and', 'systemic', 'diseases', 'in', 'the', 'near', 'future', 'The', 'coronavirus', 'disease', 'Covid', '19', 'pandemic', 'is', 'the', 'biggest', 'challenge', 'and', 'global', 'health', 'crisis', 'for', 'the', 'world', 'since', 'World', 'War', 'Two', 'Rapid', 'and', 'accurate', 'diagnosis', 'of', 'Covid', '19', 'is', 'crucial', 'in', 'controlling', 'the', 'outbreak', 'in', 'the', 'community', 'and', 'in', 'hospitals', 'Nasopharyngeal', 'and', 'oropharyngeal', 'swabs', 'are', 'the', 'recommended', 'specimen', 'types', 'for', 'Covid', '19', 'diagnostic', 'testing', 'The', 'collection', 'of', 'these', 'specimen', 'types', 'requires', 'close', 'contact', 'between', 'healthcare', 'workers', 'and', 'patients', 'and', 'poses', 'a', 'risk', 'of', 'transmission', 'of', 'the', 'virus', 'causes', 'discomfort', 'and', 'may', 'cause', 'bleeding', 'especially', 'in', 'patients', 'with', 'condition', 'such', 'as', 'thrombocytopenia', 'Hence', 'nasopharyngeal', 'or', 'oropharyngeal', 'swabs', 'are', 'not', 'desirable', 'for', 'sequential', 'monitoring', 'of', 'viral', 'load', 'Saliva', 'specimens', 'can', 'be', 'obtained', 'easily', 'as', 'the', 'patient', 'is', 'asked', 'to', 'spit', 'into', 'a', 'sterile', 'bottle', 'The', 'collection', 'of', 'saliva', 'is', 'non', 'invasive', 'and', 'greatly', 'minimizes', 'the', 'exposure', 'of', 'healthcare', 'workers', 'to', 'Covid', '19', 'Saliva', 'has', 'a', 'high', 'consistency', 'rate', 'of', 'greater', 'than', '90', 'with', 'nasopharyngeal', 'specimens', 'in', 'the', 'detection', 'of', 'respiratory', 'viruses', 'including', 'coronaviruses', 'Saliva', 'has', 'also', 'been', 'used', 'in', 'screening', 'respiratory', 'viruses', 'among', 'hospitalized', 'patients', 'without', 'pyrexia', 'or', 'respiratory', 'symptoms', 'SARS', 'CoV', 'can', 'be', 'detected', 'in', 'saliva', 'at', 'high', 'titers', 'Salivary', 'diagnostics', 'is', 'a', 'dynamic', 'field', 'that', 'is', 'being', 'incorporated', 'as', 'part', 'of', 'disease', 'diagnosis', 'clinical', 'monitoring', 'of', 'systemic', 'health', 'and', 'to', 'make', 'significant', 'clinical', 'decisions', 'for', 'patient', 'care', 'More', 'research', 'is', 'required', 'to', 'analyze', 'the', 'potential', 'diagnostic', 'of', 'Covid', '19', 'in', 'saliva', 'to', 'develop', 'rapid', 'chair', 'side', 'tests', 'for', 'the', 'detection', 'of', 'Covid', '19', 'and', 'it', 'is', 'also', 'pivotal', 'to', 'improve', 'and', 'develop', 'successful', 'strategies', 'for', 'prevention', 'especially', 'for', 'dentists', 'and', 'healthcare', 'professionals', 'who', 'are', 'involved', 'in', 'performing', 'aerosol', 'generating', 'procedures', '']"
200837,Two linear epitopes on the SARS-CoV-2 spike protein that elicit neutralising antibodies in COVID-19 patients,2020-06-01,Nat Commun,https://www.ncbi.nlm.nih.gov/pubmed/32483236/; https://doi.org/10.1038/s41467-020-16638-2,"Given the ongoing SARS-CoV-2 pandemic, identification of immunogenic targets against the coronavirus spike glycoprotein will provide crucial advances towards the development of sensitive diagnostic tools and potential vaccine candidate targets. In this study, using pools of overlapping linear B-cell peptides, we report two IgG immunodominant regions on SARS-CoV-2 spike glycoprotein that are recognised by sera from COVID-19 convalescent patients. Notably, one is specific to SARS-CoV-2, which is located in close proximity to the receptor binding domain. The other region, which is localised at the fusion peptide, could potentially function as a pan-SARS target. Functionally, antibody depletion assays demonstrate that antibodies targeting these immunodominant regions significantly alter virus neutralisation capacities. Taken together, identification and validation of these neutralising B-cell epitopes will provide insights towards the design of diagnostics and vaccine candidates against this high priority coronavirus.",10.1038/s41467-020-16638-2,p9u6rlue,"['Given', 'the', 'ongoing', 'SARS', 'CoV', '2', 'pandemic', 'identification', 'of', 'immunogenic', 'targets', 'against', 'the', 'coronavirus', 'spike', 'glycoprotein', 'will', 'provide', 'crucial', 'advances', 'towards', 'the', 'development', 'of', 'sensitive', 'diagnostic', 'tools', 'and', 'potential', 'vaccine', 'candidate', 'targets', 'In', 'this', 'study', 'using', 'pools', 'of', 'overlapping', 'linear', 'B', 'cell', 'peptides', 'we', 'report', 'two', 'IgG', 'immunodominant', 'regions', 'on', 'SARS', 'CoV', '2', 'spike', 'glycoprotein', 'that', 'are', 'recognised', 'by', 'sera', 'from', 'COVID', '19', 'convalescent', 'patients', 'Notably', 'one', 'is', 'specific', 'to', 'SARS', 'CoV', '2', 'which', 'is', 'located', 'in', 'close', 'proximity', 'to', 'the', 'receptor', 'binding', 'domain', 'The', 'other', 'region', 'which', 'is', 'localised', 'at', 'the', 'fusion', 'peptide', 'could', 'potentially', 'function', 'as', 'a', 'pan', 'SARS', 'target', 'Functionally', 'antibody', 'depletion', 'assays', 'demonstrate', 'that', 'antibodies', 'targeting', 'these', 'immunodominant', 'regions', 'significantly', 'alter', 'virus', 'neutralisation', 'capacities', 'Taken', 'together', 'identification', 'and', 'validation', 'of', 'these', 'neutralising', 'B', 'cell', 'epitopes', 'will', 'provide', 'insights', 'towards', 'the', 'design', 'of', 'diagnostics', 'and', 'vaccine', 'candidates', 'against', 'this', 'high', 'priority', 'coronavirus', '']"
