,title,publish_time,journal,url,abstract,doi,cord_uid,words
72984,A Review of Salivary Diagnostics and Its Potential Implication in Detection of Covid-19,2020,Cureus,https://doi.org/10.7759/cureus.7708,"Saliva is an exocrine secretion produced from the salivary glands and has numerous functions, such as cleansing and protection of the oral cavity, antimicrobial effects and aids in digestion Due to the speedy development in the field of salivaomics, saliva is now well accepted as a pool of biological markers that vary from changes in biochemicals, nucleic acids and proteins to the microflora Saliva has an immense potential as a diagnostic fluid and offers an edge over other biological fluids as its collection method does not require invasive procedure, economical and is useful for monitoring systemic health Development of sensitive and precise salivary diagnostic tools and the formulation of defined guidelines following meticulous testing will allow salivary diagnostics to be utilised as chair side tests for various oral and systemic diseases in the near future The coronavirus disease (Covid-19) pandemic is the biggest challenge and global health crisis for the world since World War Two Rapid and accurate diagnosis of Covid-19 is crucial in controlling the outbreak in the community and in hospitals Nasopharyngeal and oropharyngeal swabs are the recommended specimen types for Covid-19 diagnostic testing The collection of these specimen types requires close contact between healthcare workers and patients and poses a risk of transmission of the virus, causes discomfort and may cause bleeding, especially in patients with condition such as thrombocytopenia Hence, nasopharyngeal or oropharyngeal swabs are not desirable for sequential monitoring of viral load Saliva specimens can be obtained easily as the patient is asked to spit into a sterile bottle The collection of saliva is non-invasive and greatly minimizes the exposure of healthcare workers to Covid-19 Saliva has a high consistency rate of greater than 90% with nasopharyngeal specimens in the detection of respiratory viruses, including coronaviruses Saliva has also been used in screening respiratory viruses among hospitalized patients without pyrexia or respiratory symptoms SARS-CoV can be detected in saliva at high titers Salivary diagnostics is a dynamic field that is being incorporated as part of disease diagnosis, clinical monitoring of systemic health and to make significant clinical decisions for patient care More research is required to analyze the potential diagnostic of Covid-19 in saliva to develop rapid chair side tests for the detection of Covid-19 and it is also pivotal to improve and develop successful strategies for prevention, especially for dentists and healthcare professionals who are involved in performing aerosol-generating procedures",10.7759/cureus.7708,awy3aans,"['Saliva', 'is', 'an', 'exocrine', 'secretion', 'produced', 'from', 'the', 'salivary', 'glands', 'and', 'has', 'numerous', 'functions', 'such', 'as', 'cleansing', 'and', 'protection', 'of', 'the', 'oral', 'cavity', 'antimicrobial', 'effects', 'and', 'aids', 'in', 'digestion', 'Due', 'to', 'the', 'speedy', 'development', 'in', 'the', 'field', 'of', 'salivaomics', 'saliva', 'is', 'now', 'well', 'accepted', 'as', 'a', 'pool', 'of', 'biological', 'markers', 'that', 'vary', 'from', 'changes', 'in', 'biochemicals', 'nucleic', 'acids', 'and', 'proteins', 'to', 'the', 'microflora', 'Saliva', 'has', 'an', 'immense', 'potential', 'as', 'a', 'diagnostic', 'fluid', 'and', 'offers', 'an', 'edge', 'over', 'other', 'biological', 'fluids', 'as', 'its', 'collection', 'method', 'does', 'not', 'require', 'invasive', 'procedure', 'economical', 'and', 'is', 'useful', 'for', 'monitoring', 'systemic', 'health', 'Development', 'of', 'sensitive', 'and', 'precise', 'salivary', 'diagnostic', 'tools', 'and', 'the', 'formulation', 'of', 'defined', 'guidelines', 'following', 'meticulous', 'testing', 'will', 'allow', 'salivary', 'diagnostics', 'to', 'be', 'utilised', 'as', 'chair', 'side', 'tests', 'for', 'various', 'oral', 'and', 'systemic', 'diseases', 'in', 'the', 'near', 'future', 'The', 'coronavirus', 'disease', 'Covid', '19', 'pandemic', 'is', 'the', 'biggest', 'challenge', 'and', 'global', 'health', 'crisis', 'for', 'the', 'world', 'since', 'World', 'War', 'Two', 'Rapid', 'and', 'accurate', 'diagnosis', 'of', 'Covid', '19', 'is', 'crucial', 'in', 'controlling', 'the', 'outbreak', 'in', 'the', 'community', 'and', 'in', 'hospitals', 'Nasopharyngeal', 'and', 'oropharyngeal', 'swabs', 'are', 'the', 'recommended', 'specimen', 'types', 'for', 'Covid', '19', 'diagnostic', 'testing', 'The', 'collection', 'of', 'these', 'specimen', 'types', 'requires', 'close', 'contact', 'between', 'healthcare', 'workers', 'and', 'patients', 'and', 'poses', 'a', 'risk', 'of', 'transmission', 'of', 'the', 'virus', 'causes', 'discomfort', 'and', 'may', 'cause', 'bleeding', 'especially', 'in', 'patients', 'with', 'condition', 'such', 'as', 'thrombocytopenia', 'Hence', 'nasopharyngeal', 'or', 'oropharyngeal', 'swabs', 'are', 'not', 'desirable', 'for', 'sequential', 'monitoring', 'of', 'viral', 'load', 'Saliva', 'specimens', 'can', 'be', 'obtained', 'easily', 'as', 'the', 'patient', 'is', 'asked', 'to', 'spit', 'into', 'a', 'sterile', 'bottle', 'The', 'collection', 'of', 'saliva', 'is', 'non', 'invasive', 'and', 'greatly', 'minimizes', 'the', 'exposure', 'of', 'healthcare', 'workers', 'to', 'Covid', '19', 'Saliva', 'has', 'a', 'high', 'consistency', 'rate', 'of', 'greater', 'than', '90', 'with', 'nasopharyngeal', 'specimens', 'in', 'the', 'detection', 'of', 'respiratory', 'viruses', 'including', 'coronaviruses', 'Saliva', 'has', 'also', 'been', 'used', 'in', 'screening', 'respiratory', 'viruses', 'among', 'hospitalized', 'patients', 'without', 'pyrexia', 'or', 'respiratory', 'symptoms', 'SARS', 'CoV', 'can', 'be', 'detected', 'in', 'saliva', 'at', 'high', 'titers', 'Salivary', 'diagnostics', 'is', 'a', 'dynamic', 'field', 'that', 'is', 'being', 'incorporated', 'as', 'part', 'of', 'disease', 'diagnosis', 'clinical', 'monitoring', 'of', 'systemic', 'health', 'and', 'to', 'make', 'significant', 'clinical', 'decisions', 'for', 'patient', 'care', 'More', 'research', 'is', 'required', 'to', 'analyze', 'the', 'potential', 'diagnostic', 'of', 'Covid', '19', 'in', 'saliva', 'to', 'develop', 'rapid', 'chair', 'side', 'tests', 'for', 'the', 'detection', 'of', 'Covid', '19', 'and', 'it', 'is', 'also', 'pivotal', 'to', 'improve', 'and', 'develop', 'successful', 'strategies', 'for', 'prevention', 'especially', 'for', 'dentists', 'and', 'healthcare', 'professionals', 'who', 'are', 'involved', 'in', 'performing', 'aerosol', 'generating', 'procedures']"
77844,Rapid and accurate detection of novel coronavirus SARS-CoV-2 using CRISPR-Cas3,2020-06-02,,http://medrxiv.org/cgi/content/short/2020.06.02.20119875v1?rss=1,"Novel coronavirus SARS-CoV-2 outbreaks have rapidly spread to multiple countries, highlighting the urgent necessity for fast, sensitive, and specific diagnostic tools for virus surveillance. Here, the previously unknown collateral single-stranded DNA cleavage we observed with type I CRISPR-Cas3 highlights its potential for development as a Cas3-mediated rapid (within 40 min), low-cost, instrument-free detection method for SARS-CoV-2. This Cas3-based assay is comparable with Cas12- and real-time reverse-transcriptase PCR-based assays in its speed and sensitivity, but offers greater specificity for single-base-pair discrimination while negating the need for highly trained operators. These findings support the use of CRISPR diagnostics for point-of-care testing in patients with suspected SARS-CoV-2 infections.",10.1101/2020.06.02.20119875,mqvp28h1,"['Novel', 'coronavirus', 'SARS', 'CoV', '2', 'outbreaks', 'have', 'rapidly', 'spread', 'to', 'multiple', 'countries', 'highlighting', 'the', 'urgent', 'necessity', 'for', 'fast', 'sensitive', 'and', 'specific', 'diagnostic', 'tools', 'for', 'virus', 'surveillance', 'Here', 'the', 'previously', 'unknown', 'collateral', 'single', 'stranded', 'DNA', 'cleavage', 'we', 'observed', 'with', 'type', 'I', 'CRISPR', 'Cas3', 'highlights', 'its', 'potential', 'for', 'development', 'as', 'a', 'Cas3', 'mediated', 'rapid', 'within', '40', 'min', 'low', 'cost', 'instrument', 'free', 'detection', 'method', 'for', 'SARS', 'CoV', '2', 'This', 'Cas3', 'based', 'assay', 'is', 'comparable', 'with', 'Cas12', 'and', 'real', 'time', 'reverse', 'transcriptase', 'PCR', 'based', 'assays', 'in', 'its', 'speed', 'and', 'sensitivity', 'but', 'offers', 'greater', 'specificity', 'for', 'single', 'base', 'pair', 'discrimination', 'while', 'negating', 'the', 'need', 'for', 'highly', 'trained', 'operators', 'These', 'findings', 'support', 'the', 'use', 'of', 'CRISPR', 'diagnostics', 'for', 'point', 'of', 'care', 'testing', 'in', 'patients', 'with', 'suspected', 'SARS', 'CoV', '2', 'infections', '']"
79007,Nano-enabled biosensing systems for intelligent healthcare: towards COVID-19 management,2020,Mater. Today Chem.,https://doi.org/10.1016/j.mtchem.2020.100306,"Biosensors are emerging as efficient (sensitive and selective) and affordable analytical diagnostic tools for early-stage disease detection, as required for personalized health wellness management. Low-level detection of a targeted disease biomarker (pM level) has emerged extremely useful to evaluate the progression of disease under therapy. Such collected bioinformatics and its multi-aspects-oriented analytics is in demand to explore the effectiveness of a prescribed treatment, optimize therapy, and correlate biomarker level with disease pathogenesis. Owing to nanotechnology-enabled advancements in sensing unit fabrication, device integration, interfacing, packaging, and sensing performance at point-of-care (POC) has rendered diagnostics according to the requirements of disease management and patient disease profile i.e. in a personalized manner. Efforts are continuously being made to promote the state of art biosensing technology as a next-generation non-invasive disease diagnostics methodology. Keeping this in view, this progressive opinion article describes personalized health care management related analytical tools which can provide access to better health for everyone, with overreaching aim to manage healthy tomorrow timely. Considering accomplishments and predictions, such affordable intelligent diagnostics tools are urgently required to manage COVID-19 pandemic, a life-threatening respiratory infectious disease, where a rapid, selective and sensitive detection of human beta severe acute respiratory system coronavirus (SARS-COoV-2) protein is the key factor.",10.1016/j.mtchem.2020.100306,4vjf6sgs,"['Biosensors', 'are', 'emerging', 'as', 'efficient', 'sensitive', 'and', 'selective', 'and', 'affordable', 'analytical', 'diagnostic', 'tools', 'for', 'early', 'stage', 'disease', 'detection', 'as', 'required', 'for', 'personalized', 'health', 'wellness', 'management', 'Low', 'level', 'detection', 'of', 'a', 'targeted', 'disease', 'biomarker', 'pM', 'level', 'has', 'emerged', 'extremely', 'useful', 'to', 'evaluate', 'the', 'progression', 'of', 'disease', 'under', 'therapy', 'Such', 'collected', 'bioinformatics', 'and', 'its', 'multi', 'aspects', 'oriented', 'analytics', 'is', 'in', 'demand', 'to', 'explore', 'the', 'effectiveness', 'of', 'a', 'prescribed', 'treatment', 'optimize', 'therapy', 'and', 'correlate', 'biomarker', 'level', 'with', 'disease', 'pathogenesis', 'Owing', 'to', 'nanotechnology', 'enabled', 'advancements', 'in', 'sensing', 'unit', 'fabrication', 'device', 'integration', 'interfacing', 'packaging', 'and', 'sensing', 'performance', 'at', 'point', 'of', 'care', 'POC', 'has', 'rendered', 'diagnostics', 'according', 'to', 'the', 'requirements', 'of', 'disease', 'management', 'and', 'patient', 'disease', 'profile', 'i', 'e', 'in', 'a', 'personalized', 'manner', 'Efforts', 'are', 'continuously', 'being', 'made', 'to', 'promote', 'the', 'state', 'of', 'art', 'biosensing', 'technology', 'as', 'a', 'next', 'generation', 'non', 'invasive', 'disease', 'diagnostics', 'methodology', 'Keeping', 'this', 'in', 'view', 'this', 'progressive', 'opinion', 'article', 'describes', 'personalized', 'health', 'care', 'management', 'related', 'analytical', 'tools', 'which', 'can', 'provide', 'access', 'to', 'better', 'health', 'for', 'everyone', 'with', 'overreaching', 'aim', 'to', 'manage', 'healthy', 'tomorrow', 'timely', 'Considering', 'accomplishments', 'and', 'predictions', 'such', 'affordable', 'intelligent', 'diagnostics', 'tools', 'are', 'urgently', 'required', 'to', 'manage', 'COVID', '19', 'pandemic', 'a', 'life', 'threatening', 'respiratory', 'infectious', 'disease', 'where', 'a', 'rapid', 'selective', 'and', 'sensitive', 'detection', 'of', 'human', 'beta', 'severe', 'acute', 'respiratory', 'system', 'coronavirus', 'SARS', 'COoV', '2', 'protein', 'is', 'the', 'key', 'factor', '']"
107580,Two linear epitopes on the SARS-CoV-2 spike protein that elicit neutralising antibodies in COVID-19 patients,2020,Nat Commun,,"Given the ongoing SARS-CoV-2 pandemic, identification of immunogenic targets against the coronavirus spike glycoprotein will provide crucial advances towards the development of sensitive diagnostic tools and potential vaccine candidate targets. In this study, using pools of overlapping linear B-cell peptides, we report two IgG immunodominant regions on SARS-CoV-2 spike glycoprotein that are recognised by sera from COVID-19 convalescent patients. Notably, one is specific to SARS-CoV-2, which is located in close proximity to the receptor binding domain. The other region, which is localised at the fusion peptide, could potentially function as a pan-SARS target. Functionally, antibody depletion assays demonstrate that antibodies targeting these immunodominant regions significantly alter virus neutralisation capacities. Taken together, identification and validation of these neutralising B-cell epitopes will provide insights towards the design of diagnostics and vaccine candidates against this high priority coronavirus.",,budjcbej,"['Given', 'the', 'ongoing', 'SARS', 'CoV', '2', 'pandemic', 'identification', 'of', 'immunogenic', 'targets', 'against', 'the', 'coronavirus', 'spike', 'glycoprotein', 'will', 'provide', 'crucial', 'advances', 'towards', 'the', 'development', 'of', 'sensitive', 'diagnostic', 'tools', 'and', 'potential', 'vaccine', 'candidate', 'targets', 'In', 'this', 'study', 'using', 'pools', 'of', 'overlapping', 'linear', 'B', 'cell', 'peptides', 'we', 'report', 'two', 'IgG', 'immunodominant', 'regions', 'on', 'SARS', 'CoV', '2', 'spike', 'glycoprotein', 'that', 'are', 'recognised', 'by', 'sera', 'from', 'COVID', '19', 'convalescent', 'patients', 'Notably', 'one', 'is', 'specific', 'to', 'SARS', 'CoV', '2', 'which', 'is', 'located', 'in', 'close', 'proximity', 'to', 'the', 'receptor', 'binding', 'domain', 'The', 'other', 'region', 'which', 'is', 'localised', 'at', 'the', 'fusion', 'peptide', 'could', 'potentially', 'function', 'as', 'a', 'pan', 'SARS', 'target', 'Functionally', 'antibody', 'depletion', 'assays', 'demonstrate', 'that', 'antibodies', 'targeting', 'these', 'immunodominant', 'regions', 'significantly', 'alter', 'virus', 'neutralisation', 'capacities', 'Taken', 'together', 'identification', 'and', 'validation', 'of', 'these', 'neutralising', 'B', 'cell', 'epitopes', 'will', 'provide', 'insights', 'towards', 'the', 'design', 'of', 'diagnostics', 'and', 'vaccine', 'candidates', 'against', 'this', 'high', 'priority', 'coronavirus', '']"
123445,CRISPR-cas systems based molecular diagnostic tool for infectious diseases and emerging 2019 novel coronavirus (COVID-19) pneumonia,2020,J Drug Target,,"Emerging infectious diseases, the persistent potential for destabilising pandemics, remain a global threat leading to excessive morbidity and mortality. The current outbreak of pneumonia caused by 2019 novel coronavirus (COVID-19) illustrated difficulties in lack of effective drugs for treatment. Accurate and rapid diagnostic tools are essential for early recognition and treatment of infectious diseases, allowing timely implementation of infection control, improved clinical care and other public health measures to stop the spread of the disease. CRISPR-Cas technology speed up the development of infectious disease diagnostics with high rapid and accurate. In this review, we summarise current advance regarding diverse CRISPR-Cas systems, including CRISPR-Cas9, CRISPR-Cas12 and CRISPR-Cas13, in the development of fast, accurate and portable diagnostic tests and highlight the potential of CRISPR-Cas13 in COVID-19 Pneumonia and other emerging infectious diseases diagnosis.",,5uv9kaxf,"['Emerging', 'infectious', 'diseases', 'the', 'persistent', 'potential', 'for', 'destabilising', 'pandemics', 'remain', 'a', 'global', 'threat', 'leading', 'to', 'excessive', 'morbidity', 'and', 'mortality', 'The', 'current', 'outbreak', 'of', 'pneumonia', 'caused', 'by', '2019', 'novel', 'coronavirus', 'COVID', '19', 'illustrated', 'difficulties', 'in', 'lack', 'of', 'effective', 'drugs', 'for', 'treatment', 'Accurate', 'and', 'rapid', 'diagnostic', 'tools', 'are', 'essential', 'for', 'early', 'recognition', 'and', 'treatment', 'of', 'infectious', 'diseases', 'allowing', 'timely', 'implementation', 'of', 'infection', 'control', 'improved', 'clinical', 'care', 'and', 'other', 'public', 'health', 'measures', 'to', 'stop', 'the', 'spread', 'of', 'the', 'disease', 'CRISPR', 'Cas', 'technology', 'speed', 'up', 'the', 'development', 'of', 'infectious', 'disease', 'diagnostics', 'with', 'high', 'rapid', 'and', 'accurate', 'In', 'this', 'review', 'we', 'summarise', 'current', 'advance', 'regarding', 'diverse', 'CRISPR', 'Cas', 'systems', 'including', 'CRISPR', 'Cas9', 'CRISPR', 'Cas12', 'and', 'CRISPR', 'Cas13', 'in', 'the', 'development', 'of', 'fast', 'accurate', 'and', 'portable', 'diagnostic', 'tests', 'and', 'highlight', 'the', 'potential', 'of', 'CRISPR', 'Cas13', 'in', 'COVID', '19', 'Pneumonia', 'and', 'other', 'emerging', 'infectious', 'diseases', 'diagnosis', '']"
125741,Automated detection of COVID-19 cases using deep neural networks with X-ray images,2020,Comput Biol Med,,"The novel coronavirus 2019 (COVID-2019), which first appeared in Wuhan city of China in December 2019, spread rapidly around the world and became a pandemic. It has caused a devastating effect on both daily lives, public health, and the global economy. It is critical to detect the positive cases as early as possible so as to prevent the further spread of this epidemic and to quickly treat affected patients. The need for auxiliary diagnostic tools has increased as there are no accurate automated toolkits available. Recent findings obtained using radiology imaging techniques suggest that such images contain salient information about the COVID-19 virus. Application of advanced artificial intelligence (AI) techniques coupled with radiological imaging can be helpful for the accurate detection of this disease, and can also be assistive to overcome the problem of a lack of specialized physicians in remote villages. In this study, a new model for automatic COVID-19 detection using raw chest X-ray images is presented. The proposed model is developed to provide accurate diagnostics for binary classification (COVID vs. No-Findings) and multi-class classification (COVID vs. No-Findings vs. Pneumonia). Our model produced a classification accuracy of 98.08% for binary classes and 87.02% for multi-class cases. The DarkNet model was used in our study as a classifier for the you only look once (YOLO) real time object detection system. We implemented 17 convolutional layers and introduced different filtering on each layer. Our model (available at (https://github.com/muhammedtalo/COVID-19)) can be employed to assist radiologists in validating their initial screening, and can also be employed via cloud to immediately screen patients.",,6aj8zsto,"['The', 'novel', 'coronavirus', '2019', 'COVID', '2019', 'which', 'first', 'appeared', 'in', 'Wuhan', 'city', 'of', 'China', 'in', 'December', '2019', 'spread', 'rapidly', 'around', 'the', 'world', 'and', 'became', 'a', 'pandemic', 'It', 'has', 'caused', 'a', 'devastating', 'effect', 'on', 'both', 'daily', 'lives', 'public', 'health', 'and', 'the', 'global', 'economy', 'It', 'is', 'critical', 'to', 'detect', 'the', 'positive', 'cases', 'as', 'early', 'as', 'possible', 'so', 'as', 'to', 'prevent', 'the', 'further', 'spread', 'of', 'this', 'epidemic', 'and', 'to', 'quickly', 'treat', 'affected', 'patients', 'The', 'need', 'for', 'auxiliary', 'diagnostic', 'tools', 'has', 'increased', 'as', 'there', 'are', 'no', 'accurate', 'automated', 'toolkits', 'available', 'Recent', 'findings', 'obtained', 'using', 'radiology', 'imaging', 'techniques', 'suggest', 'that', 'such', 'images', 'contain', 'salient', 'information', 'about', 'the', 'COVID', '19', 'virus', 'Application', 'of', 'advanced', 'artificial', 'intelligence', 'AI', 'techniques', 'coupled', 'with', 'radiological', 'imaging', 'can', 'be', 'helpful', 'for', 'the', 'accurate', 'detection', 'of', 'this', 'disease', 'and', 'can', 'also', 'be', 'assistive', 'to', 'overcome', 'the', 'problem', 'of', 'a', 'lack', 'of', 'specialized', 'physicians', 'in', 'remote', 'villages', 'In', 'this', 'study', 'a', 'new', 'model', 'for', 'automatic', 'COVID', '19', 'detection', 'using', 'raw', 'chest', 'X', 'ray', 'images', 'is', 'presented', 'The', 'proposed', 'model', 'is', 'developed', 'to', 'provide', 'accurate', 'diagnostics', 'for', 'binary', 'classification', 'COVID', 'vs', 'No', 'Findings', 'and', 'multi', 'class', 'classification', 'COVID', 'vs', 'No', 'Findings', 'vs', 'Pneumonia', 'Our', 'model', 'produced', 'a', 'classification', 'accuracy', 'of', '98', '08', 'for', 'binary', 'classes', 'and', '87', '02', 'for', 'multi', 'class', 'cases', 'The', 'DarkNet', 'model', 'was', 'used', 'in', 'our', 'study', 'as', 'a', 'classifier', 'for', 'the', 'you', 'only', 'look', 'once', 'YOLO', 'real', 'time', 'object', 'detection', 'system', 'We', 'implemented', '17', 'convolutional', 'layers', 'and', 'introduced', 'different', 'filtering', 'on', 'each', 'layer', 'Our', 'model', 'available', 'at', 'https', 'github', 'com', 'muhammedtalo', 'COVID', '19', 'can', 'be', 'employed', 'to', 'assist', 'radiologists', 'in', 'validating', 'their', 'initial', 'screening', 'and', 'can', 'also', 'be', 'employed', 'via', 'cloud', 'to', 'immediately', 'screen', 'patients', '']"
143322,CRISPR-cas systems based molecular diagnostic tool for infectious diseases and emerging 2019 novel coronavirus (COVID-19) pneumonia,2020-05-26,J Drug Target,https://doi.org/10.1080/1061186x.2020.1769637; https://www.ncbi.nlm.nih.gov/pubmed/32401064/,"Emerging infectious diseases, the persistent potential for destabilising pandemics, remain a global threat leading to excessive morbidity and mortality. The current outbreak of pneumonia caused by 2019 novel coronavirus (COVID-19) illustrated difficulties in lack of effective drugs for treatment. Accurate and rapid diagnostic tools are essential for early recognition and treatment of infectious diseases, allowing timely implementation of infection control, improved clinical care and other public health measures to stop the spread of the disease. CRISPR-Cas technology speed up the development of infectious disease diagnostics with high rapid and accurate. In this review, we summarise current advance regarding diverse CRISPR-Cas systems, including CRISPR-Cas9, CRISPR-Cas12 and CRISPR-Cas13, in the development of fast, accurate and portable diagnostic tests and highlight the potential of CRISPR-Cas13 in COVID-19 Pneumonia and other emerging infectious diseases diagnosis.",10.1080/1061186x.2020.1769637,q52mia0e,"['Emerging', 'infectious', 'diseases', 'the', 'persistent', 'potential', 'for', 'destabilising', 'pandemics', 'remain', 'a', 'global', 'threat', 'leading', 'to', 'excessive', 'morbidity', 'and', 'mortality', 'The', 'current', 'outbreak', 'of', 'pneumonia', 'caused', 'by', '2019', 'novel', 'coronavirus', 'COVID', '19', 'illustrated', 'difficulties', 'in', 'lack', 'of', 'effective', 'drugs', 'for', 'treatment', 'Accurate', 'and', 'rapid', 'diagnostic', 'tools', 'are', 'essential', 'for', 'early', 'recognition', 'and', 'treatment', 'of', 'infectious', 'diseases', 'allowing', 'timely', 'implementation', 'of', 'infection', 'control', 'improved', 'clinical', 'care', 'and', 'other', 'public', 'health', 'measures', 'to', 'stop', 'the', 'spread', 'of', 'the', 'disease', 'CRISPR', 'Cas', 'technology', 'speed', 'up', 'the', 'development', 'of', 'infectious', 'disease', 'diagnostics', 'with', 'high', 'rapid', 'and', 'accurate', 'In', 'this', 'review', 'we', 'summarise', 'current', 'advance', 'regarding', 'diverse', 'CRISPR', 'Cas', 'systems', 'including', 'CRISPR', 'Cas9', 'CRISPR', 'Cas12', 'and', 'CRISPR', 'Cas13', 'in', 'the', 'development', 'of', 'fast', 'accurate', 'and', 'portable', 'diagnostic', 'tests', 'and', 'highlight', 'the', 'potential', 'of', 'CRISPR', 'Cas13', 'in', 'COVID', '19', 'Pneumonia', 'and', 'other', 'emerging', 'infectious', 'diseases', 'diagnosis', '']"
